{
  "schema": 2,
  "full_setup": false,
  "id": "trivy",
  "name": "Trivy",
  "version": "0.0.1",
  "description": "Install Trivy as a portable binary or official Docker image",
  "order": 13,
  "min_core_api": 2,
  "platforms": [
    "linux"
  ],
  "executor": "native",
  "protocol": "jsonl-v1",
  "operations": [
    "menu",
    "status",
    "install",
    "update",
    "remove",
    "uninstall",
    "use",
    "integrate"
  ],
  "executables": {
    "linux/amd64": "bin/linux-amd64/atm-trivy",
    "linux/arm64": "bin/linux-arm64/atm-trivy"
  }
}
