{
  "schema": 2,
  "full_setup": false,
  "id": "spotatui",
  "name": "spotatui",
  "version": "0.0.1",
  "description": "Install spotatui with YouTube dependency checks",
  "order": 15,
  "min_core_api": 2,
  "platforms": [
    "linux"
  ],
  "executor": "native",
  "protocol": "jsonl-v1",
  "operations": [
    "menu",
    "status",
    "install",
    "update",
    "remove",
    "uninstall",
    "use",
    "integrate"
  ],
  "executables": {
    "linux/amd64": "bin/linux-amd64/atm-spotatui",
    "linux/arm64": "bin/linux-arm64/atm-spotatui"
  }
}
