{
  "schema": 2,
  "full_setup": false,
  "id": "brave",
  "name": "Brave Browser",
  "version": "0.0.1",
  "description": "Install Brave Browser from official repositories",
  "order": 11,
  "min_core_api": 2,
  "platforms": [
    "linux"
  ],
  "executor": "native",
  "protocol": "jsonl-v1",
  "operations": [
    "menu",
    "status",
    "install",
    "remove",
    "uninstall",
    "use"
  ],
  "executables": {
    "linux/amd64": "bin/linux-amd64/atm-brave",
    "linux/arm64": "bin/linux-arm64/atm-brave"
  }
}
