{
 "schema": 2,
 "full_setup": false,
 "id": "ai",
 "name": "AI Tools (native preview)",
 "version": "0.0.1",
 "description": "Unactivated portable AI migration preview; provider parity pending",
 "order": 9,
 "min_core_api": 2,
 "platforms": ["linux"],
 "executor": "native",
 "protocol": "jsonl-v1",
 "operations": ["menu", "status", "install", "update", "use", "remove", "uninstall"],
 "executables": {
  "linux/amd64": "bin/linux-amd64/atm-ai",
  "linux/arm64": "bin/linux-arm64/atm-ai"
 }
}
