{
  "schema": 2,
  "full_setup": false,
  "id": "zsh",
  "name": "Zsh + Oh My Zsh",
  "version": "0.0.1",
  "description": "Manage Zsh, Oh My Zsh, backups, and restore",
  "order": 12,
  "min_core_api": 2,
  "platforms": [
    "linux"
  ],
  "executor": "native",
  "protocol": "jsonl-v1",
  "operations": [
    "menu",
    "status",
    "install",
    "update",
    "remove",
    "uninstall",
    "use"
  ],
  "executables": {
    "linux/amd64": "bin/linux-amd64/atm-zsh",
    "linux/arm64": "bin/linux-arm64/atm-zsh"
  }
}
